{
  "version": "1.3.0",
  "description": "Official PURL types with registry configurations",
  "source": "https://github.com/package-url/purl-spec",
  "last_updated": "2026-10-24",
  "types": {
    "alpm": {
      "description": "Arch Linux packages and other users of the libalpm/pacman package manager.",
      "default_registry": null,
      "examples": [
        "pkg:alpm/arch/pacman@6.0.1-1?arch=x86_64",
        "pkg:alpm/arch/python-pip@21.0-1?arch=any",
        "pkg:alpm/arch/containers-common@1:0.47.4-4?arch=x86_64"
      ],
      "namespace_requirement": "required",
      "namespace_case_sensitive": false,
      "name_case_sensitive": false
    },
    "apk": {
      "description": "Alpine Linux APK-based packages",
      "default_registry": null,
      "examples": [
        "pkg:apk/alpine/curl@7.83.0-r0?arch=x86",
        "pkg:apk/alpine/apk@2.12.9-r3?arch=x86"
      ],
      "namespace_requirement": "required",
      "namespace_case_sensitive": false,
      "name_case_sensitive": false
    },
    "bitbucket": {
      "description": "Bitbucket-based packages",
      "default_registry": "https://bitbucket.org",
      "examples": [
        "pkg:bitbucket/atlassian/python-bitbucket@0.1.0",
        "pkg:bitbucket/birkenfeld/pygments-main@2.13.0",
        "pkg:bitbucket/pygame/pygame@2.1.2"
      ],
      "namespace_requirement": "required",
      "namespace_case_sensitive": false,
      "name_case_sensitive": false
    },
    "bitnami": {
      "description": "Bitnami-based packages",
      "default_registry": null,
      "examples": [
        "pkg:bitnami/wordpress?distro=debian-12",
        "pkg:bitnami/wordpress@6.2.0?distro=debian-12",
        "pkg:bitnami/wordpress@6.2.0?arch=arm64&distro=debian-12",
        "pkg:bitnami/wordpress@6.2.0?arch=arm64&distro=photon-4"
      ],
      "namespace_requirement": "prohibited",
      "name_case_sensitive": false
    },
    "cargo": {
      "description": "Cargo packages for Rust",
      "default_registry": "https://crates.io",
      "examples": [
        "pkg:cargo/rand@0.7.2",
        "pkg:cargo/clap@4.0.32",
        "pkg:cargo/serde@1.0.152"
      ],
      "registry_config": {
        "base_url": "https://crates.io/crates",
        "reverse_regex": "^https://crates\\.io/crates/([^/?#]+)",
        "uri_template": "https://crates.io/crates/{name}",
        "components": {
          "namespace": false,
          "version_in_url": false
        }
      },
      "namespace_requirement": "prohibited"
    },
    "cocoapods": {
      "description": "CocoaPods pods",
      "default_registry": "https://cdn.cocoapods.org/",
      "examples": [
        "pkg:cocoapods/Alamofire@5.6.4",
        "pkg:cocoapods/SwiftyJSON@5.0.1",
        "pkg:cocoapods/AFNetworking@4.0.1"
      ],
      "registry_config": {
        "base_url": "https://cocoapods.org/pods",
        "reverse_regex": "^https://cocoapods\\.org/pods/([^/?#]+)",
        "uri_template": "https://cocoapods.org/pods/{name}",
        "components": {
          "namespace": false,
          "version_in_url": false
        }
      },
      "namespace_requirement": "prohibited"
    },
    "composer": {
      "description": "Composer PHP packages",
      "default_registry": "https://packagist.org",
      "examples": [
        "pkg:composer/symfony/console@6.1.7",
        "pkg:composer/laravel/framework@9.42.2",
        "pkg:composer/phpunit/phpunit@9.5.27"
      ],
      "registry_config": {
        "base_url": "https://packagist.org/packages",
        "reverse_regex": "^https://packagist\\.org/packages/([^/?#]+)/([^/?#]+)",
        "uri_template": "https://packagist.org/packages/{namespace}/{name}",
        "components": {
          "namespace": true,
          "namespace_required": true,
          "version_in_url": false
        }
      },
      "namespace_requirement": "required",
      "namespace_case_sensitive": false,
      "name_case_sensitive": false
    },
    "conan": {
      "description": "Conan C/C++ packages. The purl is designed to closely resemble the Conan-native <package-name>/<package-version>@<user>/<channel> syntax for package references as specified in https://docs.conan.io/en/1.46/cheatsheet.html#package-terminology",
      "default_registry": "https://conan.io/center",
      "examples": [
        "pkg:conan/openssl@3.0.3",
        "pkg:conan/openssl.org/openssl@3.0.3?user=bincrafters&channel=stable",
        "pkg:conan/openssl.org/openssl@3.0.3?arch=x86_64&build_type=Debug&compiler=Visual%20Studio&compiler.runtime=MDd&compiler.version=16&os=Windows&shared=True&rrev=93a82349c31917d2d674d22065c7a9ef9f380c8e&prev=b429db8a0e324114c25ec387bfd8281f330d7c5c"
      ],
      "registry_config": {
        "base_url": "https://conan.io/center/recipes",
        "reverse_regex": "^https://conan\\.io/center/recipes/([^/?#]+)",
        "uri_template": "https://conan.io/center/recipes/{name}",
        "components": {
          "namespace": false,
          "version_in_url": false
        }
      },
      "namespace_requirement": "optional"
    },
    "conda": {
      "description": "conda is for Conda packages",
      "default_registry": "https://repo.anaconda.com",
      "examples": [
        "pkg:conda/numpy@1.24.1",
        "pkg:conda/pandas@1.5.2",
        "pkg:conda/matplotlib@3.6.2"
      ],
      "registry_config": {
        "base_url": "https://anaconda.org/conda-forge",
        "reverse_regex": "^https://anaconda\\.org/conda-forge/([^/?#]+)",
        "uri_template": "https://anaconda.org/conda-forge/{name}",
        "components": {
          "namespace": false,
          "version_in_url": false
        }
      },
      "namespace_requirement": "prohibited"
    },
    "cpan": {
      "description": "CPAN Perl packages",
      "default_registry": "https://www.cpan.org/",
      "examples": [
        "pkg:cpan/Moose@2.2014",
        "pkg:cpan/DBI@1.643",
        "pkg:cpan/Catalyst-Runtime@5.90128"
      ],
      "registry_config": {
        "base_url": "https://metacpan.org/dist",
        "reverse_regex": "^https://metacpan\\.org/dist/([^/?#]+)",
        "uri_template": "https://metacpan.org/dist/{name}",
        "components": {
          "namespace": false,
          "version_in_url": false
        }
      },
      "namespace_requirement": "optional"
    },
    "cran": {
      "description": "CRAN R packages",
      "default_registry": "https://cran.r-project.org",
      "examples": [
        "pkg:cran/ggplot2@3.4.0",
        "pkg:cran/dplyr@1.0.10",
        "pkg:cran/devtools@2.4.5"
      ],
      "namespace_requirement": "prohibited"
    },
    "deb": {
      "description": "Debian packages, Debian derivatives, and Ubuntu packages",
      "default_registry": null,
      "examples": [
        "pkg:deb/debian/curl@7.50.3-1?arch=i386&distro=jessie",
        "pkg:deb/debian/dpkg@1.19.0.4?arch=amd64&distro=stretch",
        "pkg:deb/ubuntu/dpkg@1.19.0.4?arch=amd64",
        "pkg:deb/debian/attr@1:2.4.47-2?arch=source",
        "pkg:deb/debian/attr@1:2.4.47-2%2Bb1?arch=amd64"
      ],
      "namespace_requirement": "required",
      "namespace_case_sensitive": false,
      "name_case_sensitive": false
    },
    "docker": {
      "description": "for Docker images",
      "default_registry": "https://hub.docker.com",
      "examples": [
        "pkg:docker/nginx@1.21.6",
        "pkg:docker/ubuntu@20.04",
        "pkg:docker/node@18.12.1"
      ],
      "namespace_requirement": "optional"
    },
    "gem": {
      "description": "RubyGems",
      "default_registry": "https://rubygems.org",
      "examples": [
        "pkg:gem/ruby-advisory-db-check@0.12.4",
        "pkg:gem/rails@7.0.4",
        "pkg:gem/bundler@2.3.26"
      ],
      "registry_config": {
        "base_url": "https://rubygems.org/gems",
        "reverse_regex": "^https://rubygems\\.org/gems/([^/?#]+)(?:/versions/([^/?#]+))?",
        "uri_template": "https://rubygems.org/gems/{name}",
        "uri_template_with_version": "https://rubygems.org/gems/{name}/versions/{version}",
        "components": {
          "namespace": false,
          "version_in_url": true,
          "version_path": "/versions/"
        }
      },
      "namespace_requirement": "prohibited"
    },
    "generic": {
      "description": "The generic type is for plain, generic packages that do not fit anywhere else such as for \"upstream-from-distro\" packages. In particular this is handy for a plain version control repository such as a bare git repo in combination with a vcs_url.",
      "default_registry": null,
      "examples": [
        "pkg:generic/openssl@1.1.10g",
        "pkg:generic/openssl@1.1.10g?download_url=https://openssl.org/source/openssl-1.1.0g.tar.gz&checksum=sha256:de4d501267da",
        "pkg:generic/bitwarderl?vcs_url=git%2Bhttps://git.fsfe.org/dxtr/bitwarderl%40cc55108da32"
      ],
      "namespace_requirement": "optional"
    },
    "github": {
      "description": "GitHub-based packages",
      "default_registry": "https://github.com",
      "examples": [
        "pkg:github/torvalds/linux@6.1",
        "pkg:github/microsoft/vscode@1.74.2",
        "pkg:github/npm/cli@9.2.0"
      ],
      "namespace_requirement": "required",
      "namespace_case_sensitive": false,
      "name_case_sensitive": false
    },
    "golang": {
      "description": "Go packages",
      "default_registry": "https://pkg.go.dev",
      "ecosystems_registry": "proxy.golang.org",
      "examples": [
        "pkg:golang/github.com/gorilla/context@234fd47e07d1004f0aed9c",
        "pkg:golang/google.golang.org/genproto#googleapis/api/annotations",
        "pkg:golang/github.com/gorilla/context@234fd47e07d1004f0aed9c#api"
      ],
      "registry_config": {
        "base_url": "https://pkg.go.dev",
        "reverse_regex": "^https://pkg\\.go\\.dev/(.+)",
        "uri_template": "https://pkg.go.dev/{namespace}/{name}",
        "components": {
          "namespace": true,
          "namespace_required": true,
          "version_in_url": false,